{
  "status": "ok",
  "request_id": "req_demo_0001",
  "timestamp_ms": 1730000000000,
  "data": {
    "mode": "IMPROVE",
    "voice_match_score": 82,
    "risk": {
      "level": "green",
      "score": 18,
      "reasons": ["Apology is clear", "No blaming language"]
    },
    "context_summary": [
      "طرف مقابل از cancel کردن last-minute ناراحت شده",
      "درخواستش: زودتر خبر بدی که استرس نگیره"
    ],
    "suggestions": [
      {
        "label": "Calm & clear",
        "text": "Hey, inam begam ke be khater-e diruz sorry. vaghean ziad stress داشتم و tone-am بد dar oomad. mikhay ye vaght koochik sohbat konim?",
        "why_it_works": "Owns the tone, keeps it simple, invites a short chat.",
        "emotion_preview": ["calm", "respectful"]
      },
      {
        "label": "Short",
        "text": "Sorry baraye diruz. tone-am bad bood. mikhay ba ham align konim?",
        "why_it_works": "Very short, low-pressure.",
        "emotion_preview": ["direct"]
      },
      {
        "label": "Warm",
        "text": "Hey ❤️ sorry baraye diruz. doost nadaram bebinam beynemun tension bemune. age ok-e, ye vaght zood 5 daghighe gap bezanim.",
        "why_it_works": "Adds warmth without guilt-tripping.",
        "emotion_preview": ["warm", "safe"]
      }
    ]
  },
  "error": null,
  "meta": {
    "contract_version": "1.0.0"
  }
}