{
  "status": "ok",
  "request_id": "req_demo_0003",
  "timestamp_ms": 1730000000000,
  "data": {
    "assistant_message": "Ok—behtar ine ham roshan begi chi mikhay, ham sade o rahat.",
    "action_steps": [
      "Yek jomle roshan darbare niyat begu",
      "Yek soaal-e baz bepors ta taraf rahat javab بده",
      "Yek message-e short pishnahadi ro send kon"
    ],
    "best_next_message": "Man alan az ashnayi khosham miad, doost daram aheste aheste hamdiaro behtar beshnasim. To chi mikhay az in rabete?",
    "risk": {
      "level": "low",
      "score": 0.1,
      "reasons": ["No self-harm intent detected", "No harassment or hate content"]
    },
    "ui_hints": {
      "collapse_context_card": true,
      "show_pinned_summary": true
    }
  },
  "error": null,
  "meta": {
    "contract_version": "1.0.0"
  }
}