{
  "status": "ok",
  "request_id": "req_demo_0002",
  "timestamp_ms": 1730000000000,
  "data": {
    "mode": "REPLY",
    "voice_match_score": 79,
    "risk": {
      "level": "yellow",
      "score": 42,
      "reasons": ["They feel stressed", "Boundary request is clear"]
    },
    "suggestions": [
      {
        "label": "Accountable",
        "text": "Ø­Ù‚ Ø¯Ø§Ø±ÛŒ. cancel Ú©Ø±Ø¯Ù†Ù last minute Ø¯Ø±Ø³Øª Ù†Ø¨ÙˆØ¯. Ø§Ø² Ø§ÛŒÙ† Ø¨Ù‡ Ø¨Ø¹Ø¯ Ø§Ú¯Ù‡ Ø§Ø­ØªÙ…Ø§Ù„ ØªØºÛŒÛŒØ± Ø¨Ø§Ø´Ù‡ Ø²ÙˆØ¯ØªØ± Ø¨Ù‡Øª Ù…ÛŒâ€ŒÚ¯Ù… ØªØ§ stress Ù†Ú¯ÛŒØ±ÛŒ.",
        "why_it_works": "Validates their feeling and commits to a concrete change.",
        "emotion_preview": ["validated", "safe"]
      },
      {
        "label": "Short",
        "text": "Ø­Ù‚ Ø¯Ø§Ø±ÛŒ. Ø§Ø² Ø§ÛŒÙ† Ø¨Ù‡ Ø¨Ø¹Ø¯ Ø²ÙˆØ¯ØªØ± Ø®Ø¨Ø± Ù…ÛŒâ€ŒØ¯Ù… ğŸ™",
        "why_it_works": "Simple + direct.",
        "emotion_preview": ["calm"]
      },
      {
        "label": "Collaborative",
        "text": "Ú©Ø§Ù…Ù„Ø§Ù‹ Ù…ÛŒâ€ŒÙÙ‡Ù…Ù…. Ø¯ÙˆØ³Øª Ø¯Ø§Ø±Ù… ÛŒÙ‡ rule Ø¨Ø°Ø§Ø±ÛŒÙ…: Ø§Ú¯Ù‡ ØªØ§ ÙÙ„Ø§Ù† Ø³Ø§Ø¹Øª Ù‚Ø·Ø¹ÛŒ Ù†Ø¨ÙˆØ¯Ù…ØŒ Ù‡Ù…ÙˆÙ† Ù…ÙˆÙ‚Ø¹ Ø¨Ù‡Øª Ø¨Ú¯Ù… Ú©Ù‡ ØªÙˆ Ù‡Ù… Ø¨Ø±Ù†Ø§Ù…Ù‡â€ŒØ±ÛŒØ²ÛŒ Ú©Ù†ÛŒ. ok-eØŸ",
        "why_it_works": "Turns it into a shared plan.",
        "emotion_preview": ["teamwork"]
      }
    ]
  },
  "error": null,
  "meta": {
    "contract_version": "1.0.0"
  }
}
